{
  "schema_version": "leva.et13.visual-cases.v1",
  "case_catalog_version": "leva.et13.catalog.v1",
  "catalog_sha256": "c5acc346a770f5890c6dd06ce616ffc1105eba12b7605e8ad985897e91b00c96",
  "projection_contract_sha256": "158fdc882238c9459995c0572536a3cec3704e92bd1b28fa2d80907fc0435b78",
  "projection_matrix": [
    {
      "fixture_id": "web-today-available",
      "capture_scope": "body_projection",
      "source_widget": "TodayMissionSection",
      "substitutions": [
        "controller/provider state replaced by approved deterministic fixture"
      ]
    },
    {
      "fixture_id": "web-path-current-week",
      "capture_scope": "body_projection",
      "source_widget": "MissionPathPlanView",
      "substitutions": [
        "controller/provider state replaced by approved deterministic fixture"
      ]
    },
    {
      "fixture_id": "web-content-reading",
      "capture_scope": "body_projection",
      "source_widget": "WebContentProjection",
      "substitutions": [
        "AdSense slot replaced by explicit offline blocked-network evidence slot"
      ]
    },
    {
      "fixture_id": "web-workspace-idle",
      "capture_scope": "body_projection",
      "source_widget": "SandboxLayout",
      "substitutions": [
        "controller state replaced by approved deterministic fixture",
        "Monaco callbacks disabled except production readiness"
      ]
    },
    {
      "fixture_id": "web-review-loaded",
      "capture_scope": "component_projection",
      "source_widget": "WebReviewProjection",
      "substitutions": [
        "controller state replaced by approved deterministic fixture"
      ]
    },
    {
      "fixture_id": "web-mentor-context-preview",
      "capture_scope": "body_projection",
      "source_widget": "WebMentorContextProjection",
      "substitutions": [
        "controller/provider state replaced by approved deterministic fixture"
      ]
    },
    {
      "fixture_id": "admin-kpi-dashboard",
      "capture_scope": "body_projection",
      "source_widget": "AdminKpiDashboardProjection",
      "substitutions": [
        "controller/provider state replaced by approved deterministic fixture"
      ]
    },
    {
      "fixture_id": "admin-support-long-wire",
      "capture_scope": "component_projection",
      "source_widget": "AdminSupportDetailProjection",
      "substitutions": [
        "live provider and dialog shell replaced by deterministic AlertDialog host"
      ]
    },
    {
      "fixture_id": "dp-design-mission-ledger",
      "capture_scope": "component_projection",
      "source_widget": "DpEt13MissionLedgerFixture",
      "substitutions": [
        "hosted by the Flutter Web production distribution"
      ]
    },
    {
      "fixture_id": "dp-design-context-payload-preview",
      "capture_scope": "component_projection",
      "source_widget": "DpEt13ContextPayloadPreviewFixture",
      "substitutions": [
        "hosted by the Flutter Web production distribution"
      ]
    },
    {
      "fixture_id": "web-community-free",
      "capture_scope": "body_projection",
      "source_widget": "WebCommunityBoardProjection",
      "substitutions": [
        "controller/provider state replaced by approved deterministic fixture"
      ]
    },
    {
      "fixture_id": "web-community-qna",
      "capture_scope": "body_projection",
      "source_widget": "WebCommunityBoardProjection",
      "substitutions": [
        "controller/provider state replaced by approved deterministic fixture"
      ]
    },
    {
      "fixture_id": "web-community-feedback",
      "capture_scope": "body_projection",
      "source_widget": "WebCommunityBoardProjection",
      "substitutions": [
        "controller/provider state replaced by approved deterministic fixture"
      ]
    }
  ],
  "fixture_ids": [
    "web-today-available",
    "web-path-current-week",
    "web-content-reading",
    "web-workspace-idle",
    "web-review-loaded",
    "web-mentor-context-preview",
    "admin-kpi-dashboard",
    "admin-support-long-wire",
    "dp-design-mission-ledger",
    "dp-design-context-payload-preview",
    "web-community-free",
    "web-community-qna",
    "web-community-feedback"
  ],
  "case_count": 104,
  "surface_case_counts": {
    "web": 72,
    "admin": 16,
    "dp_design": 16
  },
  "cases": [
    {
      "case_id": "web-today-available--visual--w320--light",
      "fixture_id": "web-today-available",
      "owner": "web",
      "distribution": "web",
      "route": "/?fixture=web-today-available",
      "ready_semantics_label": "ET13_READY:web-today-available",
      "surface_label": "web-today-available",
      "capture_scope": "body_projection",
      "source_widget": "TodayMissionSection",
      "substitutions": [
        "controller/provider state replaced by approved deterministic fixture"
      ],
      "width": 320,
      "height": 900,
      "device_pixel_ratio": 1,
      "theme": "light",
      "text_scale_percent": 100,
      "locale": "ko-KR",
      "timezone": "UTC",
      "reduced_motion": true,
      "artifact_path": "visual/web/web-today-available--visual--w320--light.png"
    },
    {
      "case_id": "web-today-available--visual--w320--dark",
      "fixture_id": "web-today-available",
      "owner": "web",
      "distribution": "web",
      "route": "/?fixture=web-today-available",
      "ready_semantics_label": "ET13_READY:web-today-available",
      "surface_label": "web-today-available",
      "capture_scope": "body_projection",
      "source_widget": "TodayMissionSection",
      "substitutions": [
        "controller/provider state replaced by approved deterministic fixture"
      ],
      "width": 320,
      "height": 900,
      "device_pixel_ratio": 1,
      "theme": "dark",
      "text_scale_percent": 100,
      "locale": "ko-KR",
      "timezone": "UTC",
      "reduced_motion": true,
      "artifact_path": "visual/web/web-today-available--visual--w320--dark.png"
    },
    {
      "case_id": "web-today-available--visual--w600--light",
      "fixture_id": "web-today-available",
      "owner": "web",
      "distribution": "web",
      "route": "/?fixture=web-today-available",
      "ready_semantics_label": "ET13_READY:web-today-available",
      "surface_label": "web-today-available",
      "capture_scope": "body_projection",
      "source_widget": "TodayMissionSection",
      "substitutions": [
        "controller/provider state replaced by approved deterministic fixture"
      ],
      "width": 600,
      "height": 900,
      "device_pixel_ratio": 1,
      "theme": "light",
      "text_scale_percent": 100,
      "locale": "ko-KR",
      "timezone": "UTC",
      "reduced_motion": true,
      "artifact_path": "visual/web/web-today-available--visual--w600--light.png"
    },
    {
      "case_id": "web-today-available--visual--w600--dark",
      "fixture_id": "web-today-available",
      "owner": "web",
      "distribution": "web",
      "route": "/?fixture=web-today-available",
      "ready_semantics_label": "ET13_READY:web-today-available",
      "surface_label": "web-today-available",
      "capture_scope": "body_projection",
      "source_widget": "TodayMissionSection",
      "substitutions": [
        "controller/provider state replaced by approved deterministic fixture"
      ],
      "width": 600,
      "height": 900,
      "device_pixel_ratio": 1,
      "theme": "dark",
      "text_scale_percent": 100,
      "locale": "ko-KR",
      "timezone": "UTC",
      "reduced_motion": true,
      "artifact_path": "visual/web/web-today-available--visual--w600--dark.png"
    },
    {
      "case_id": "web-today-available--visual--w840--light",
      "fixture_id": "web-today-available",
      "owner": "web",
      "distribution": "web",
      "route": "/?fixture=web-today-available",
      "ready_semantics_label": "ET13_READY:web-today-available",
      "surface_label": "web-today-available",
      "capture_scope": "body_projection",
      "source_widget": "TodayMissionSection",
      "substitutions": [
        "controller/provider state replaced by approved deterministic fixture"
      ],
      "width": 840,
      "height": 900,
      "device_pixel_ratio": 1,
      "theme": "light",
      "text_scale_percent": 100,
      "locale": "ko-KR",
      "timezone": "UTC",
      "reduced_motion": true,
      "artifact_path": "visual/web/web-today-available--visual--w840--light.png"
    },
    {
      "case_id": "web-today-available--visual--w840--dark",
      "fixture_id": "web-today-available",
      "owner": "web",
      "distribution": "web",
      "route": "/?fixture=web-today-available",
      "ready_semantics_label": "ET13_READY:web-today-available",
      "surface_label": "web-today-available",
      "capture_scope": "body_projection",
      "source_widget": "TodayMissionSection",
      "substitutions": [
        "controller/provider state replaced by approved deterministic fixture"
      ],
      "width": 840,
      "height": 900,
      "device_pixel_ratio": 1,
      "theme": "dark",
      "text_scale_percent": 100,
      "locale": "ko-KR",
      "timezone": "UTC",
      "reduced_motion": true,
      "artifact_path": "visual/web/web-today-available--visual--w840--dark.png"
    },
    {
      "case_id": "web-today-available--visual--w1240--light",
      "fixture_id": "web-today-available",
      "owner": "web",
      "distribution": "web",
      "route": "/?fixture=web-today-available",
      "ready_semantics_label": "ET13_READY:web-today-available",
      "surface_label": "web-today-available",
      "capture_scope": "body_projection",
      "source_widget": "TodayMissionSection",
      "substitutions": [
        "controller/provider state replaced by approved deterministic fixture"
      ],
      "width": 1240,
      "height": 900,
      "device_pixel_ratio": 1,
      "theme": "light",
      "text_scale_percent": 100,
      "locale": "ko-KR",
      "timezone": "UTC",
      "reduced_motion": true,